{"catalogue_id":"mathhead.domain-assumption-rules.v1","mathematical_authority":false,"policy":"exact structural matches only; no semantic inference","rules":[{"arity":null,"description":"Copy one declared builtin domain record without carrier inference.","fact_kind":"builtin_domain","match_kind":"builtin","match_name":null,"mathematical_authority":false,"origin_registry":"domains","rule_id":"mh.normalize.domain.builtin","supported":true},{"arity":null,"description":"Copy one declared finite domain and its exact element and cardinality references.","fact_kind":"finite_domain","match_kind":"finite","match_name":null,"mathematical_authority":false,"origin_registry":"domains","rule_id":"mh.normalize.domain.finite","supported":true},{"arity":null,"description":"Copy one declared interval including exact base, endpoints, and closure flags.","fact_kind":"interval_domain","match_kind":"interval","match_name":null,"mathematical_authority":false,"origin_registry":"domains","rule_id":"mh.normalize.domain.interval","supported":true},{"arity":null,"description":"Copy one declared modular carrier and exact modulus expression reference.","fact_kind":"modular_domain","match_kind":"modular","match_name":null,"mathematical_authority":false,"origin_registry":"domains","rule_id":"mh.normalize.domain.modular","supported":true},{"arity":null,"description":"Copy one declared collection kind, element domain, and finiteness state.","fact_kind":"collection_domain","match_kind":"collection","match_name":null,"mathematical_authority":false,"origin_registry":"domains","rule_id":"mh.normalize.domain.collection","supported":true},{"arity":null,"description":"Copy one ordered declared product-domain factor list.","fact_kind":"product_domain","match_kind":"product","match_name":null,"mathematical_authority":false,"origin_registry":"domains","rule_id":"mh.normalize.domain.product","supported":true},{"arity":null,"description":"Copy one ordered function-domain signature and its declared totality flag.","fact_kind":"function_domain","match_kind":"function","match_name":null,"mathematical_authority":false,"origin_registry":"domains","rule_id":"mh.normalize.domain.function","supported":true},{"arity":null,"description":"Copy one theory-structure domain with exact ordered parameters.","fact_kind":"structure_domain","match_kind":"structure","match_name":null,"mathematical_authority":false,"origin_registry":"domains","rule_id":"mh.normalize.domain.structure","supported":true},{"arity":null,"description":"Bind one variable to its explicitly declared domain and role.","fact_kind":"variable_domain","match_kind":"variable","match_name":null,"mathematical_authority":false,"origin_registry":"variables","rule_id":"mh.normalize.variable.domain","supported":true},{"arity":null,"description":"Retain an explicit truth-valued assumption without evaluation.","fact_kind":"truth_assumption","match_kind":"truth","match_name":null,"mathematical_authority":false,"origin_registry":"assumptions","rule_id":"mh.normalize.assumption.truth","supported":true},{"arity":null,"description":"Retain an exact equality relation and operand order.","fact_kind":"equality_assumption","match_kind":"relation","match_name":"equal","mathematical_authority":false,"origin_registry":"assumptions","rule_id":"mh.normalize.assumption.equal","supported":true},{"arity":null,"description":"Retain an exact disequality relation and operand order.","fact_kind":"disequality_assumption","match_kind":"relation","match_name":"not_equal","mathematical_authority":false,"origin_registry":"assumptions","rule_id":"mh.normalize.assumption.not-equal","supported":true},{"arity":null,"description":"Retain one exact ordered comparison as a bound-shaped structural fact.","fact_kind":"bound_assumption","match_kind":"relation","match_name":"ordered_comparison","mathematical_authority":false,"origin_registry":"assumptions","rule_id":"mh.normalize.assumption.bound","supported":true},{"arity":null,"description":"Retain exact membership operands without set-theoretic inference.","fact_kind":"membership_assumption","match_kind":"relation","match_name":"member","mathematical_authority":false,"origin_registry":"assumptions","rule_id":"mh.normalize.assumption.member","supported":true},{"arity":null,"description":"Retain exact nonmembership operands without complement inference.","fact_kind":"nonmembership_assumption","match_kind":"relation","match_name":"not_member","mathematical_authority":false,"origin_registry":"assumptions","rule_id":"mh.normalize.assumption.not-member","supported":true},{"arity":null,"description":"Retain an exact divisibility relation without arithmetic evaluation.","fact_kind":"divisibility_assumption","match_kind":"relation","match_name":"divides","mathematical_authority":false,"origin_registry":"assumptions","rule_id":"mh.normalize.assumption.divides","supported":true},{"arity":null,"description":"Retain exact congruence operands without modular evaluation.","fact_kind":"congruence_assumption","match_kind":"relation","match_name":"congruent","mathematical_authority":false,"origin_registry":"assumptions","rule_id":"mh.normalize.assumption.congruent","supported":true},{"arity":2,"description":"Recognize an exact disequality whose one operand is the exact integer or rational literal zero, without simplifying the other operand.","fact_kind":"nonzero_assumption","match_kind":"relation_pattern","match_name":"not_equal_zero","mathematical_authority":false,"origin_registry":"assumptions","rule_id":"mh.normalize.assumption.nonzero-relation","supported":true},{"arity":null,"description":"Retain any future or malformed relation shape as unsupported rather than guessing its meaning.","fact_kind":"opaque_relation_assumption","match_kind":"relation","match_name":null,"mathematical_authority":false,"origin_registry":"assumptions","rule_id":"mh.normalize.assumption.opaque-relation","supported":false},{"arity":1,"description":"Recognize only the exact catalogued nonzero predicate identity.","fact_kind":"nonzero_assumption","match_kind":"predicate","match_name":"org.mathhead.property.nonzero","mathematical_authority":false,"origin_registry":"assumptions","rule_id":"mh.normalize.predicate.nonzero","supported":true},{"arity":1,"description":"Recognize only the exact catalogued finiteness predicate identity.","fact_kind":"finiteness_assumption","match_kind":"predicate","match_name":"org.mathhead.property.finite","mathematical_authority":false,"origin_registry":"assumptions","rule_id":"mh.normalize.predicate.finite","supported":true},{"arity":2,"description":"Recognize only the exact catalogued cardinality predicate identity.","fact_kind":"cardinality_assumption","match_kind":"predicate","match_name":"org.mathhead.property.cardinality","mathematical_authority":false,"origin_registry":"assumptions","rule_id":"mh.normalize.predicate.cardinality","supported":true},{"arity":2,"description":"Recognize only the exact catalogued dimension predicate identity.","fact_kind":"dimension_assumption","match_kind":"predicate","match_name":"org.mathhead.property.dimension","mathematical_authority":false,"origin_registry":"assumptions","rule_id":"mh.normalize.predicate.dimension","supported":true},{"arity":2,"description":"Recognize only the exact catalogued graph-class predicate identity.","fact_kind":"graph_class_assumption","match_kind":"predicate","match_name":"org.mathhead.graph.class","mathematical_authority":false,"origin_registry":"assumptions","rule_id":"mh.normalize.predicate.graph-class","supported":true},{"arity":2,"description":"Recognize only the exact catalogued regularity predicate identity.","fact_kind":"regularity_assumption","match_kind":"predicate","match_name":"org.mathhead.analysis.regularity","mathematical_authority":false,"origin_registry":"assumptions","rule_id":"mh.normalize.predicate.regularity","supported":true},{"arity":null,"description":"Retain every unlisted predicate explicitly as unsupported opaque structure.","fact_kind":"opaque_predicate_assumption","match_kind":"predicate","match_name":null,"mathematical_authority":false,"origin_registry":"assumptions","rule_id":"mh.normalize.assumption.opaque-predicate","supported":false},{"arity":null,"description":"Retain a logical assumption tree without Boolean rewriting or flattening.","fact_kind":"logical_assumption","match_kind":"logical","match_name":null,"mathematical_authority":false,"origin_registry":"assumptions","rule_id":"mh.normalize.assumption.logical","supported":false},{"arity":null,"description":"Retain a quantified assumption tree without binder or body normalization.","fact_kind":"quantified_assumption","match_kind":"quantified","match_name":null,"mathematical_authority":false,"origin_registry":"assumptions","rule_id":"mh.normalize.assumption.quantified","supported":false}],"schema":"mathhead.domain-assumption-rules.v1"}
